{
  "schema_version": 1,
  "product_id": "spectra",
  "catalog_version": "1.0.0",
  "blueprints": [
    {
      "id": "BPC-CONFLUENCE-PROJECT", "version": "1.0.0", "kind": "confluence-project", "title": "BC-Projektbereich", "purpose": "Schlanke gemeinsame Wurzelstruktur für jedes Business-Central-Projekt.",
      "profiles": ["implementation", "support-only", "fit-gap-only", "migration"],
      "artifacts": [
        {"template_id":"TPL-CONF-00-SUPPORT","title":"00 Support","source_path":"contract/blueprints/templates/confluence/00-support.md","target_path":"collaboration/pages/00 Support.md","purpose":"Interner Einstieg für System-, Kontakt- und Supportinformationen.","leading_location":"Projekt-Space","required_fields":["bc_deployment","environment_links","login_procedure","contacts","responsibilities","escalation_path"],"optional_fields":["support_hours","known_limits"],"allowed_references":["role","decision","support"],"content_boundary":"Keine Passwörter oder Tokens; nur Verfahren und sichere Secret-Referenzen.","visibility":"internal_restricted","blank":true},
        {"template_id":"TPL-CONF-01-COMPANY","title":"01 Unternehmen","source_path":"contract/blueprints/templates/confluence/01-unternehmen.md","target_path":"collaboration/pages/01 Unternehmen.md","purpose":"Geschäftsmodell, Organisation und Prozesskontext des Unternehmens.","leading_location":"Projekt-Space","required_fields":["business_model","organization","process_landscape"],"optional_fields":["locations","glossary","legal_context"],"allowed_references":["process","role","source"],"content_boundary":"Nur durch die Kundeninstanz bestätigte Unternehmensinformationen.","visibility":"project_shared","blank":true},
        {"template_id":"TPL-CONF-02-BC","title":"02 Business Central","source_path":"contract/blueprints/templates/confluence/02-business-central.md","target_path":"collaboration/pages/02 Business Central.md","purpose":"Führender Einstieg für BC-Lösung, Setup und Architekturentscheidungen.","leading_location":"Projekt-Space","required_fields":["solution_scope","bc_areas","setup_decisions"],"optional_fields":["integrations","reports","permissions"],"allowed_references":["decision","setup","integration","role"],"content_boundary":"Keine erfundene produktive Konfiguration oder Systemaktivität.","visibility":"project_shared","blank":true},
        {"template_id":"TPL-CONF-03-PROJECTS","title":"03 Projekte","source_path":"contract/blueprints/templates/confluence/03-projekte.md","target_path":"collaboration/pages/03 Projekte.md","purpose":"Projektüberblick, Scope, Phasen, Deliverables und Entscheidungen.","leading_location":"Projekt-Space","required_fields":["scope","phases","deliverables","roles"],"optional_fields":["timeline","budget_boundary"],"allowed_references":["offer","ticket","decision","risk","deliverable"],"content_boundary":"Projektwerte entstehen ausschließlich in der Kundeninstanz.","visibility":"project_shared","blank":true},
        {"template_id":"TPL-CONF-04-MANUALS","title":"04 Handbücher","source_path":"contract/blueprints/templates/confluence/04-handbuecher.md","target_path":"collaboration/pages/04 Handbücher.md","purpose":"Kundenbezogene Bedien- und Betriebsanleitungen geordnet referenzieren.","leading_location":"Projekt-Space","required_fields":["audience","owner","validity"],"optional_fields":["training_reference","support_reference"],"allowed_references":["process","training","support","external-file"],"content_boundary":"Keine ungeprüften oder als freigegeben erfundenen Handbuchinhalte.","visibility":"project_shared","blank":true},
        {"template_id":"TPL-CONF-99-ARCHIVE","title":"99 Archiv","source_path":"contract/blueprints/templates/confluence/99-archiv.md","target_path":"collaboration/pages/99 Archiv.md","purpose":"Ersetzte oder abgeschlossene Inhalte nachvollziehbar aufbewahren.","leading_location":"Projekt-Space","required_fields":["archive_reason","superseded_by","archived_at"],"optional_fields":["retention_rule"],"allowed_references":["page","decision","deliverable"],"content_boundary":"Keine stille Löschung und kein Archivieren ohne Grund und Nachfolger.","visibility":"internal_restricted","blank":true}
      ]
    },
    {
      "id": "BPC-JIRA-PROJECT", "version": "1.0.0", "kind": "jira-project", "title": "Jira-Projektstruktur", "purpose": "Portable Projekthierarchie mit klarer abrechenbarer Arbeitseinheit.",
      "profiles": ["implementation", "support-only", "fit-gap-only", "migration"],
      "artifacts": [
        {"template_id":"TPL-JIRA-STRUCTURE","title":"Jira-Projekt-Blueprint","source_path":"contract/blueprints/templates/jira/project-structure.json","target_path":"collaboration/jira-project-blueprint.json","purpose":"Phase, Epic, Story und Task hierarchisch und portabel beschreiben.","leading_location":"Projektworkspace","required_fields":["hierarchy","billable_work_item"],"optional_fields":["project_specific_mapping"],"allowed_references":["phase","epic","story","task","evidence"],"content_boundary":"Nur Tasks sind abrechenbar; keine Live-Jira-Konfiguration.","visibility":"internal_restricted","blank":true}
      ]
    },
    {
      "id": "BPC-BLANK-DOCUMENTS", "version": "1.0.0", "kind": "blank-documents", "title": "Consulting-Blankovorlagen", "purpose": "Ehrlich leere Vorlagen für wiederkehrende Projekt- und Betriebsartefakte.",
      "profiles": ["implementation", "support-only", "fit-gap-only", "migration"],
      "artifacts": [
        {"template_id":"TPL-DOC-PROJECT-OVERVIEW","title":"Projektüberblick und Scope","source_path":"contract/blueprints/templates/documents/project-overview-scope.md","target_path":"templates/project-overview-scope.md","purpose":"Ziel, Scope, Annahmen und Ausschlüsse erfassen.","leading_location":"03 Projekte","required_fields":["objective","scope","assumptions","exclusions"],"optional_fields":["milestones"],"allowed_references":["offer","deliverable","decision"],"content_boundary":"Keine vorausgefüllten Kunden- oder Budgetwerte.","visibility":"project_shared","blank":true},
        {"template_id":"TPL-DOC-FIT-GAP","title":"Discovery und Fit-Gap","source_path":"contract/blueprints/templates/documents/discovery-fit-gap.md","target_path":"templates/discovery-fit-gap.md","purpose":"Prozessanforderung, Standardfit, Gap und Optionen bewerten.","leading_location":"03 Prozesse und Fit-to-Standard","required_fields":["process","requirement","classification","options"],"optional_fields":["estimate"],"allowed_references":["process","requirement","decision"],"content_boundary":"Keine automatische Fit- oder Gap-Entscheidung.","visibility":"project_shared","blank":true},
        {"template_id":"TPL-DOC-DECISION","title":"Entscheidung","source_path":"contract/blueprints/templates/documents/decision.md","target_path":"templates/decision.md","purpose":"Optionen, Wirkung und fachliche Entscheidung dokumentieren.","leading_location":"90 Entscheidungen","required_fields":["question","options","decision","reason"],"optional_fields":["conditions"],"allowed_references":["requirement","risk","deliverable"],"content_boundary":"Status bleibt offen, bis die Kundeninstanz entscheidet.","visibility":"project_shared","blank":true},
        {"template_id":"TPL-DOC-SOLUTION-DESIGN","title":"Lösungsdesign","source_path":"contract/blueprints/templates/documents/solution-design.md","target_path":"templates/solution-design.md","purpose":"Zielbild, Standardkonfiguration und Abweichungen beschreiben.","leading_location":"02 Business Central","required_fields":["context","design","dependencies","validation"],"optional_fields":["alternatives"],"allowed_references":["decision","setup","integration","test"],"content_boundary":"Keine produktive Konfiguration behaupten.","visibility":"project_shared","blank":true},
        {"template_id":"TPL-DOC-UAT","title":"Test und UAT","source_path":"contract/blueprints/templates/documents/test-uat.md","target_path":"templates/test-uat.md","purpose":"Testziel, Fälle, Evidence und Exitkriterien vorbereiten.","leading_location":"07 Test und UAT","required_fields":["scope","cases","entry_criteria","exit_criteria"],"optional_fields":["defects"],"allowed_references":["process","test","evidence","decision"],"content_boundary":"Keine simulierte oder reale Abnahme vorbefüllen.","visibility":"project_shared","blank":true},
        {"template_id":"TPL-DOC-TRAINING","title":"Schulung","source_path":"contract/blueprints/templates/documents/training.md","target_path":"templates/training.md","purpose":"Zielgruppe, Lernziele, Übungen und Nachweis vorbereiten.","leading_location":"04 Handbücher","required_fields":["audience","objectives","exercises"],"optional_fields":["competency_check"],"allowed_references":["role","process","evidence"],"content_boundary":"Keine erfundene Teilnahme oder Kompetenz bestätigen.","visibility":"project_shared","blank":true},
        {"template_id":"TPL-DOC-HANDOVER","title":"Übergabe und Hypercare","source_path":"contract/blueprints/templates/documents/handover-hypercare.md","target_path":"templates/handover-hypercare.md","purpose":"Hypercare, offene Punkte und Betriebsübergabe strukturieren.","leading_location":"10 Hypercare und Betrieb","required_fields":["entry","daily_control","exit","ownership"],"optional_fields":["known_issues"],"allowed_references":["ticket","evidence","support","decision"],"content_boundary":"Keine Übergabe oder Abnahme als abgeschlossen markieren.","visibility":"project_shared","blank":true},